{
  "schema_version": "1.0",
  "manifest_id": "manifest-public-demo-001",
  "session_id": "session-public-demo-001",
  "subject": "mathematics",
  "course": "introductory-analysis",
  "topic": "epsilon-delta continuity",
  "concepts": ["epsilon-delta continuity", "quantifier order"],
  "weakness_tags": ["quantifier-order"],
  "mistakes": [{"type": "quantifier-order"}],
  "open_questions": ["How does uniform continuity change the quantifiers?"],
  "difficulty": "medium",
  "practice_priority": 4,
  "source_notes": ["synthetic-public-demo"],
  "requested_question_count": 7,
  "practice_modes": ["proof", "oral-explanation"],
  "no_agent": true,
  "hint_gradient": [
    "independent_attempt",
    "direction_only",
    "key_observation",
    "skeleton",
    "full_solution"
  ],
  "created_at": "2026-01-01T10:05:00Z"
}
